{
  "name": "Microsoft",
  "shortName": "Microsoft",
  "description": "Microsoft is proud to support the Python Community and the PyCon DE & PyData Berlin Conference. Visual Studio Code, our lightweight, free and open source editor lets developers write better code faster with extensions for Python. Microsoft Azure enables you to develop & run your code easily in the cloud. Azure DevOps supports you to automate the deployment of your data application.",
  "logo": "/static/media/sponsors/microsoft.png"
}
